doandan,like,linkanh,loai,noidung,tacgia,tags,thoigian,tieude,url
"Tại họp báo về dự kiến chương trình kỳ họp thứ 3, Quốc hội khóa XV vào chiều 20/5, Phó Chủ nhiệm Văn phòng Quốc hội Vũ Minh Tuấn cho biết, theo dự kiến chương trình, Quốc hội sẽ làm việc trong thời gian 19 ngày.",,"https://static-images.vnncdn.net/files/publish/2022/5/20/6d4b029eb4d874862dc9-959.jpg,https://static-images.vnncdn.net/files/publish/2022/5/20/quoc-hoi-960.jpg",Thời sự,"Cụ thể, kỳ họp Quốc hội sẽ khai mạc vào ngày 23/5 và bế mạc vào ngày 16/6. Trong đó, Quốc hội dành 8 ngày làm việc cho công tác lập pháp; thời gian dành cho việc xem xét các báo cáo, chất vấn và các vấn đề quan trọng khác khoảng 11 ngày. Quốc hội sẽ xem xét, thông qua 5 dự án luật, 3 dự thảo Nghị quyết và cho ý kiến 6 dự án luật khác.  Các dự án Luật, dự thảo Nghị quyết được Quốc hội xem xét, thông qua, gồm: Luật Cảnh sát cơ động; Luật Điện ảnh (sửa đổi); Luật Kinh doanh bảo hiểm (sửa đổi); Luật Thi đua, khen thưởng (sửa đổi); Luật sửa đổi, bổ sung một số điều của Luật Sở hữu trí tuệ; Nghị quyết về thí điểm mô hình tổ chức hoạt động lao động, hướng nghiệp, dạy nghề cho phạm nhân ngoài trại giam; Nghị quyết về Chương trình xây dựng luật, pháp lệnh năm 2023, điều chỉnh Chương trình xây dựng luật, pháp lệnh năm 2022; Nghị quyết về thí điểm một số cơ chế, chính sách đặc thù, phát triển tỉnh Khánh Hòa. Các dự án Luật được Quốc hội xem xét, cho ý kiến gồm: Luật Dầu khí (sửa đổi); Luật Phòng, chống bạo lực gia đình (sửa đổi); Luật Thanh tra (sửa đổi); Luật Thực hiện dân chủ ở cơ sở; Luật sửa đổi, bổ sung một số điều của Luật Tần số vô tuyến điện; Luật Khám bệnh, chữa bệnh (sửa đổi). Ngoài ra, Quốc hội xem xét, cho ý kiến các báo cáo về đánh giá bổ sung kết quả thực hiện kế hoạch phát triển kinh tế - xã hội và ngân sách nhà nước năm 2021; tình hình thực hiện kế hoạch phát triển kinh tế - xã hội và ngân sách nhà nước những tháng đầu năm 2022; phê chuẩn quyết toán ngân sách nhà nước năm 2020; báo cáo về công tác thực hành tiết kiệm chống lãng phí năm 2021. Một nội dung đáng chú ý khác được Quốc hội xem xét, quyết định tại kỳ họp này là chủ trương đầu tư 5 dự án: Dự án đường Vành đai 4 vùng Thủ đô Hà Nội; dự án đường Vành đai 3 TP.HCM; dự án đường bộ cao tốc Biên Hòa -Vũng Tàu; dự án đường bộ cao tốc Khánh Hòa - Buôn Ma Thuột; dự án đường bộ cao tốc Châu Đốc - Cần Thơ - Sóc Trăng. Quốc hội cũng xem xét việc tổng kết, đánh giá tổng thể tình hình thực hiện Nghị quyết số 66/2013 về điều chỉnh một số nội dung và giải pháp nhằm tiếp tục thực hiện có hiệu quả chủ trương đầu tư xây dựng đường Hồ Chí Minh theo Nghị quyết số 38/2004 và kế hoạch triển khai dự án đường Hồ Chí Minh giai đoạn tiếp theo. Cùng với đó, Quốc hội giám sát tối cao việc thực hiện chính sách, pháp luật về công tác quy hoạch kể từ khi Luật Quy hoạch có hiệu lực thi hành; xem xét, thông qua các Nghị quyết về Chương trình giám sát và thành lập Đoàn giám sát chuyên đề của Quốc hội năm 2023; tiến hành chất vấn và trả lời chất vấn đại biểu Quốc hội. Quốc hội xem xét, quyết định việc chuyển vốn vay về cho vay lại, bảo lãnh Chính phủ thành cấp phát ngân sách nhà nước.   Cũng tại kỳ họp này, Quốc hội nghe Ủy ban Trung ương Mặt trận Tổ quốc Việt Nam báo cáo tổng hợp ý kiến, kiến nghị của cử tri và nhân dân gửi đến kỳ họp; nghe Ủy ban Thường vụ Quốc hội báo cáo kết quả giám sát việc giải quyết kiến nghị của cử tri gửi đến kỳ họp thứ 2. Đồng thời, Quốc hội cũng xem xét, thông qua Nghị quyết kỳ họp thứ 3, Quốc hội khóa XV. Trả lời báo chí, Tổng thư ký Quốc hội Bùi Văn Cường cho biết, hiện nay, công tác chất vấn, trả lời chất vấn tại kỳ họp thứ 3 tiếp tục tiến hành với thời lượng 2,5 ngày. Trong đó, Quốc hội sẽ chất vấn Thủ tướng Chính phủ, theo thông lệ kỳ họp giữa năm sẽ do Phó Thủ tướng sẽ trả lời. Về nội dung chất vấn, Tổng thư ký Quốc hội cho biết, đến ngày 23/5, sau khi nhận đủ đề nghị của các đoàn ĐBQH, trên cơ sở đó xin ý kiến các đại biểu về các nhóm vấn đề đưa ra chất vấn. Sau đó để xin ý kiến Ủy ban Thường vụ Quốc hội mới quyết định vấn đề chất vấn. Cho tới thời điểm hiện nay, Văn phòng Quốc hội mới nhận được 18 báo cáo của đoàn ĐBQH. Trong đó, có 29 nhóm vấn đề liên quan tới Thủ tướng, TAND tối cao, 14 bộ trưởng, trưởng ngành.",Thu Hằng - Trần Thường," đường cao tốc , Bùi Văn Cường ",20/05/2022   17:19 (GMT+07:00),Quốc hội sắp thông qua chủ trương 5 dự án đường cao tốc mới,https://vietnamnet.vn/quoc-hoi-sap-thong-qua-chu-truong-5-du-an-duong-cao-toc-moi-2021567.html
Hai mẫu xe điện của tập đoàn Hyundai là Ioniq 5 và KIA EV6 đã buộc phải triệu hồi tổng cộng gần 20.000 chiếc vì lỗi phần mềm khiến xe có thể tự trôi khi đỗ.,,,Ô tô - Xe máy,,Hoàng Hiệp," triệu hồi xe , Hyundai Ioniq 5 , Kia EV6 , xe điện ",19/05/2022   10:01 (GMT+07:00),"Sắp về Việt Nam, xe điện Hyundai Ioniq 5 và Kia EV6 bị lỗi phần mềm phải triệu hồi ở Mỹ",https://vietnamnet.vn/sap-ve-viet-nam-xe-dien-hyundai-ioniq-5-va-kia-ev6-bi-loi-phan-mem-phai-trieu-hoi-o-my-2021006.html
Xem trực tiếp bóng đá U23 Việt Nam vs U23 Thái Lan - Cập nhật kênh phát sóng và link xem trực tiếp trận U23 Việt Nam vs U23 Thái Lan thuộc chung kết môn bóng đá Nam SEA Games 31.,,https://static-images.vnncdn.net/files/publish/2022/5/21/u23-viet-nam-vs-u23-thai-lan-498.jpg,Thể thao,"Trận chung kết bóng đá nam giữa U23 Việt Nam vs U23 Thái Lan diễn ra vào lúc 19h00 ngày 22/5, trên sân Mỹ Đình, Hà Nội. Khán giả có thể theo dõi trực tiếp các trận bóng đá nam các trên kênh VTV6, On Football. Ngoài ra, cũng có thể xem trên các kênh Youtube VFF Channel, Next Sports, VTV Sports. Để phục vụ quý độc giả, VietNamNet sẽ tường thuật trực tiếp và cập nhật link xem trận đấu giữa U23 Việt Nam vs U23 Thái Lan.  Văn Toản; Tiến Long, Thanh Bình, Việt Anh; Tuấn Tài, Hoàng Đức, Hùng Dũng, Công Đến, Quang Nho; Tiến Linh, Mạnh Dũng. Kawin; Nakin Winsetchat, Jonathan Khemdee, Chonnapat Buaphan, Airfan Doloh; Chaiyapipat, Weerathep Pompun, Ekanit Panya, Worachit, Ben Davis, Gustavson."," , ,Đội hình xuất phát , vs U23 Thái Lan:,U23 Việt Nam:,U23 Thái Lan: ,Thiên Bình"," U23 Việt Nam , U23 Thái Lan , SEA Games , HLV Park Hang Seo , HLV Mano Polking ",21/05/2022   15:38 (GMT+07:00),"Xem trực tiếp bóng đá U23 Việt Nam vs U23 Thái Lan, chung kết SEA Games 31",https://vietnamnet.vn/xem-truc-tiep-bong-da-u23-viet-nam-vs-u23-thai-lan-chung-ket-sea-games-31-2021834.html
Lịch thi đấu chung kết bóng đá nam SEA Games 31 - Cung cấp lịch thi đấu trận chung kết môn bóng đá nam SEA Games 31 giữa U23 Việt Nam vs U23 Thái Lan.,,https://static-images.vnncdn.net/files/publish/2022/5/21/u23-viet-nam-vs-u23-thai-lan-502.jpeg,Thể thao,"22/5 - 16h00: U23 Indonesia vs U23 Malaysia (VTV6, On Football) 22/5 - 19h00: U23 Thái Lan vs U23 Việt Nam (VTV6, On Football) Môn bóng đá nam   đã đi đến những trận đấu cuối cùng khi U23 Việt Nam chạm trán đối thủ nhiều duyên nợ U23 Thái Lan ở chung kết, trong khi U23 Malaysia đối đầu U23 Indonesia để tranh tấm HCĐ. Trận chung kết tranh HCV diễn ra vào lúc 19h ngày 22/5. Trước đó, trận HCĐ diễn ra vào lúc 16h cùng ngày.  .","Lịch thi đấu chung kết và tranh HCĐ bóng đá nam SEA Games 31,Cả hai trận đấu này đều diễn ra trên SVĐ Quốc gia Mỹ Đình,U23 Thái Lan,Thiên Bình", Lịch thi đấu bóng đá ,21/05/2022   16:07 (GMT+07:00),Lịch thi đấu chung kết bóng đá nam SEA Games 31: U23 Việt Nam vs U23 Thái Lan,https://vietnamnet.vn/lich-thi-dau-chung-ket-bong-da-nam-sea-games-31-u23-viet-nam-vs-u23-thai-lan-2020984.html
"Mới đây, doanh nhân võng xếp Duy Lợi chia sẻ thông tin sẽ khui công mẫu xe được mệnh danh là khủng long Apocalypse HellFire 6×6.",,,Ô tô - Xe máy,,Theo Báo Giao thông," Apocolypse Hellfire , xe 6 bánh Việt Nam ",19/05/2022   16:09 (GMT+07:00),"Đại gia võng xếp Duy Lợi tậu ""khủng long"" 6 bánh độc nhất Việt Nam",https://vietnamnet.vn/dai-gia-vong-xep-duy-loi-tau-khung-long-6-banh-doc-nhat-viet-nam-2021064.html
"Nam thanh niên điều khiển xe máy lao nhanh qua ngã tư mà không giảm tốc độ để quan sát, thiếu chút nữa đã phải trả giá bằng cả mạng sống.",,,Ô tô - Xe máy,"Tình huống giao thông được camera giám sát ghi lại, cho thấy khoảnh khắc hai thanh niên điều khiển xe máy băng nhanh qua ngã tư mà không hề giảm tốc độ để quan sát, đúng lúc một chiếc xe trộn bê tông đi ngang qua. Nam thanh niên đi phía trước, do khoảng cách quá gần và không kịp xử lý, nên đã bị trượt ngã, lọt vào gầm xe trộn bê tông. Trong khi đó, thanh niên đi xe máy phía sau, do khoảng cách còn khá xa, nên kịp thời phanh gấp, tạo nên một tình huống ""drift"" bất đắc dĩ, đủ kịp tránh tông mạnh vào hông của xe trộn bê tông. Chiếc xe máy của nam thanh niên đi trước đã bị xe trộn bê tông kéo lê một đoạn trên đường, nhưng may mắn là thanh niên này, theo quán tính, đã bị trượt về phía trước, thay vì lọt vào gầm xe trộn bê tông. Đoạn clip về tình huống giao thông thót tim này đã gây sốt sau khi được đăng tải lên mạng xã hội. Cư dân mạng đều cho rằng cặp đôi đi xe máy đã quá may mắn khi thoát chết trong tình huống này. ""Giảm tốc độ khi đi qua đoạn đường giao nhau là bài học cơ bản và nằm lòng ngay ngày đầu điều khiển phương tiện ra đường, vậy mà cặp đôi thanh niên chạy xe máy này phóng như bay qua ngã tư như vậy, thật quá xem thường mạng sống của mình và người khác. Phải nói là quá may mắn cho cả hai khi thoát chết trong tình huống này"", tài khoản Facebook M.Phúc bình luận sau khi xem đoạn clip. ""Qua ngã tư mà phóng như bay thế này thì đúng là quá liều mạng. Nếu vẫn giữ thói quen đi đường kiểu bất chấp thế này thì tôi e là không phải lúc nào may mắn cũng mỉm cười như trong trường hợp này đâu"", người dùng Facebook T.Bình chia sẻ. ""Đường thì mưa trơn trượt, ngã tư thì tầm nhìn bị hạn chế vậy mà vẫn phóng như bay, quá sức là liều mạng. Nếu trường hợp này mà không may tông vào người đi xe máy hoặc xe đạp thì lại gây họa cho người khác. Quả thực là quá may mắn cho cả hai thanh niên này và cho cả tài xế chiếc xe trộn bê tông"", một người dùng mạng xã hội khác bình luận. Trong khi đó, nhiều cư dân mạng hy vọng rằng tình huống giao thông này sẽ là bài học đáng nhớ, không chỉ cho hai thanh niên trong đoạn clip, mà là cho tất cả những người tham gia giao thông, hãy luôn nhớ giảm tốc độ và quan sát kỹ trước khi băng qua những đoạn đường giao nhau để tránh tai nạn đáng tiếc.",Theo Dân trí," tình huống giao thông , phóng nhanh , xe máy ",19/05/2022   16:07 (GMT+07:00),"Phóng nhanh qua ngã tư, thanh niên chạy xe máy suýt phải trả giá cực đắt",https://vietnamnet.vn/phong-nhanh-qua-nga-tu-thanh-nien-chay-xe-may-suyt-phai-tra-gia-cuc-dat-2021067.html
"Kết quả bóng đá hôm nay 21/5 - Cập nhật nhanh kết quả bóng đá chung kết bóng đá nữ SEA Games 31, vòng 38 La Liga, vòng 38 Serie A và vòng 38 Ligue 1.",,,Thể thao,"21/5 - 15h30: Myanmar - Philippines  (VTV6, On Football) 21/5 - 19h00: Việt Nam - Thái Lan (VTV6, On Football) 21/05 - 02:00: Rayo Vallecano 2-4 Levante 21/05 - 02:00: Real Madrid 0-0 Betis 21/05 - 22:30: Valencia - Celta Vigo 21/05 - 01:45: Torino 0-3 Roma 21/05 - 22:15: Genoa - Bologna","Kết quả chung kết và tranh HCĐ bóng đá nữ SEA Games 31:,Kết quả vòng 38 La Liga:,Kết quả vòng 38 Serie A,Thiên Bình", Kết quả bóng đá ,21/05/2022   05:06 (GMT+07:00),Kết quả bóng đá hôm nay 21/5,https://vietnamnet.vn/ket-qua-bong-da-hom-nay-21-5-2021622.html
"Chính phủ New Zealand quyết định mở cửa biên giới hoàn toàn cho học sinh, sinh viên quốc tế 31/7/2022, việc này tạo điều kiện thuận lợi cho sinh viên Việt Nam nộp thị thực học sinh/sinh viên sớm hơn so với dự kiến.",,https://static-images.vnncdn.net/files/publish/2022/5/18/hinh-2-1128.jpg,Giáo dục,"Mới đây, Chính phủ New Zealand đã có thông báo chính thức về việc mở cửa biên giới hoàn toàn cho học sinh, sinh viên quốc tế từ 23h59 ngày 31/7/2022 ( theo giờ New Zealand), thay vì vào tháng 10/2022 như kế hoạch trước đây. Với học sinh, sinh viên Việt Nam, thông báo này tạo điều kiện thuận lợi hơn cho việc chuẩn bị và xin thị thực học sinh/sinh viên (Student Visa). “Đây là một bước tiến quan trọng, gửi đi một thông điệp mạnh mẽ rằng, New Zealand đã sẵn sàng mở cửa lại hoàn toàn với thế giới, trong đó bao gồm mảng giáo dục quốc tế. Chúng tôi mong chờ chào đón học sinh, sinh viên trên toàn thế giới đến và khám phá nền giáo dục tuyệt vời của New Zealand” - Ông Grant McPherson, Tổng Giám đốc Điều hành Cơ quan Giáo dục New Zealand (ENZ) cho hay. Ngoài ra, trong thông báo mới nhất này, Chính phủ New Zealand cũng công bố một số điều chỉnh về thị thực Post-Study Work Rights (PSW) – quyền lợi cho phép sinh viên quốc tế ở lại làm việc sau khi tốt nghiệp tại nước này. Theo đó, khi theo học toàn thời gian tại New Zealand ít nhất 30 tuần, sinh viên sẽ đủ điều kiện nộp hồ sơ xin thị thực PSW cho các chương trình đào tạo Cử nhân, Cử nhân Danh dự , Chứng chỉ Sau đại học, Thạc sĩ hay Tiến sĩ. Thời hạn thị thực PSW được cấp tương đương với thời gian du học sinh theo học toàn thời gian tại New Zealand, với thời gian tối đa lên đến ba năm. Riêng bậc Thạc sĩ và Tiến sĩ, thời gian thị thực PSW vẫn được giữ nguyên là 3 năm, với điều kiện nghiên cứu sinh quốc tế phải theo học ít nhất 30 tuần toàn thời gian tại New Zealand. Đối với những sinh viên theo học chương trình cấp độ 7 không văn bằng (Level 7 non-degree) trở xuống, bao gồm chương trình Graduate Diplomas hay Diplomas cấp độ 7, người học sẽ đủ điều kiện xét duyệt thị thực PSW nếu chương trình theo học nằm trong nhóm Nghề nghiệp Ưu tiên. Sau khi tốt nghiệp, sinh viên quốc tế sẽ được phép làm việc trong lĩnh vực đã theo học.  Ngoài ra, các sinh viên theo học tại New Zealand vẫn được quyền đi làm bán thời gian tối đa 20 tiếng/tuần trong học kỳ và toàn thời gian trong các kì nghỉ. Những thay đổi này chỉ được áp dụng với sinh viên quốc tế nộp thị thực từ ngày 11/5/2022 trở đi.  “Những thay đổi sắp tới nhằm bảo đảm rằng sinh viên sẽ nhận được các giá trị xứng đáng so với những gì họ đã đầu tư, và những sinh viên tiếp tục ở lại làm việc tại New Zealand cũng có thể bổ sung khoảng trống kỹ năng của thị trường lao động, và đóng góp cho sự phát triển của nền kinh tế” - Ông Chris Hipkins, Bộ trưởng Bộ Giáo Dục New Zealand chia sẻ.  (theo ENZ)",Việt Dũng," du học New Zealand , chính sách thị thực ",18/05/2022   19:10 (GMT+07:00),"New Zealand mở cửa cho sinh viên quốc tế, thay đổi chính sách thị thực",https://vietnamnet.vn/new-zealand-mo-cua-cho-sinh-vien-quoc-te-thay-doi-chinh-sach-thi-thuc-2020847.html
"Phòng Giáo dục và Đào tạo (GD-ĐT) huyện Châu Đức, tỉnh Bà Rịa - Vũng Tàu đã chỉ đạo việc xác minh, làm rõ thông tin cô giáo dạy tiếng Anh một trường THCS trên địa bàn bị “tố” thường xuyên đánh, xúc phạm học sinh trong giờ học.",,"https://static-images.vnncdn.net/files/publish/2022/5/17/anh-1-1265.jpg,https://static-images.vnncdn.net/files/publish/2022/5/17/anh-2-1266.jpg",Giáo dục,"Hôm nay (17/5), trao đổi với  , thầy Trần Thạnh - Hiệu trưởng Trường THCS Quang Trung (xã Nghĩa Thành, huyện Châu Đức) cho biết, nhà trường vẫn đang tiến hành xử lý việc cô giáo N.T.K.L. (giáo viên môn tiếng Anh) bị tố đánh, xúc phạm học sinh trong giờ học. “Vụ việc đã được nhà trường nắm từ đầu tháng 4 đến bây giờ, nhà trường đã làm 5-6 bước rồi, vẫn đang làm, do học sinh nôn nóng giải quyết sự việc quá thôi. Cấp trên nói xong việc mới cung cấp thông tin cho báo chí, bây giờ không cung cấp được dữ liệu gì hết !”, thầy Thạnh trả lời qua điện thoại. Về nội dung bài viết đăng tải trên mạng xã hội, thầy Thạnh cho rằng không đúng bản chất sự việc, từ ngày 5/4 nhà trường đã nhận được phản ánh và đang xử lý đến bây giờ. Trước đó, trên mạng xã hội Facebook lan truyền bài viết của tài khoản “Khang Nguyễn” với nội dung “tố” đích danh cô giáo N.T.K.L. nhiều lần đánh đập, xúc phạm học sinh trong giờ học. Kèm theo đó là đoạn video ngắn ghi lại cảnh một nữ giáo viên dùng thanh gỗ đánh liên tiếp vào người học sinh. Bài viết sau khi đăng tải vài giờ đã thu hút hàng trăm lượt bình luận, chia sẻ và bày tỏ cảm xúc. Một số người tỏ ra bức xúc trước việc làm của cô L. theo nội dung thông tin đăng tải, trong khi một số tỏ ra hoài nghi về tính khách quan của bài viết. Theo tài khoản này đăng tải, cô L. thường xuyên xúc phạm học sinh 2 lớp khối 9 trong giờ học với lời lẽ khó nghe.  “Cổ là giáo viên mà dùng lời lẽ thô tục, phản cảm để chửi chúng em … nghe như dân chợ búa và rất áp lực mỗi khi sợ làm bài, sai nhẹ thì bị chửi, nặng thì bị đánh, mà cổ nhấp thước nhiều lần mới đánh mạnh một lần nên rất sợ, sợ đến nỗi có bạn phải trốn tiết của cổ” - người tố cáo viết.  Cũng theo tài khoản này, ngoài đánh và xúc phạm học sinh, cô L. còn không công bằng trong chấm điểm đối với học sinh không đi học thêm. Cuối bài viết, tài khoản này cho biết đã hơn 1 tháng gửi tâm thư, kiến nghị lên hiệu trường nhà trường để đổi giáo viên dạy tiếng Anh nhưng chưa được giải quyết. “Chúng em sắp ra trường nên lúc đầu cũng sợ ảnh hưởng đến tốt nghiệp, nhưng giờ chúng em bức xúc quá không thể chịu đựng… Chúng em muốn mỗi ngày đến trường là một ngày vui, đặc biệt là những ngày tháng cuối cấp”. Liên quan đến sự việc trên, trao đổi với VietNamNet, ông Lê Thanh Kính - Trưởng phòng GD-ĐT huyện Châu Đức cho biết đã chỉ đạo các đơn vị liên quan của phòng xác minh nội dung, đồng thời giao cho Phó trưởng phòng trực tiếp làm việc, kiểm tra để làm rõ. Cùng ngày, UBND huyện Châu Đức cũng đã chỉ đạo cho Phòng GD-ĐT huyện nhanh chóng vào xác minh, kiểm tra sự việc trên và báo cáo huyện.",Quang Hưng," Bà Rịa - Vung Tàu , Bạo Lực Học Đường ",17/05/2022   20:23 (GMT+07:00),Cô giáo tiếng Anh bị tố đánh đập học trò 'như cơm bữa',https://vietnamnet.vn/co-giao-tieng-anh-bi-to-danh-dap-hoc-tro-nhu-com-bua-2020455.html
Khoảng hơn 20.000 học sinh TP.HCM sẽ rớt lớp 10 công lập trong kỳ tuyển sinh 2022-2023. Tuy nhiên học sinh sẽ không thiếu chỗ ở các trường ngoài công lập.,,https://static-images.vnncdn.net/files/publish/2022/5/18/tu-thuc-89.jpg,Giáo dục,"Chỉ tiêu vào các trường THPT công lập ở TP.HCM năm nay đáp ứng gần 80% nhu cầu học sinh lớp 9. Tuy nhiên các em sẽ không thiếu chỗ học ở các trường tư thục, trung tâm giáo dục thường xuyên, hệ trung cấp trong các trường cao đẳng, các trường trung cấp trên địa bàn TP.HCM. Đối với các trường tư thục, UBND TP.HCM yêu cầu các trường thực hiện công tác tuyển sinh theo kế hoạch chủ động của từng trường, không vượt quá chỉ tiêu được giao hàng năm và phù hợp với quy định.  Thời gian tuyển sinh từ 1/7 đến 25/8. Phải báo cáo danh sách tuyển sinh khối 10 cho Sở GD-ĐT trước ngày 31/8.   Ngoài ra, học sinh đã tốt nghiệp THCS có thể đăng ký xét tuyển vào học tại các trường cao đẳng, trung cấp, trung tâm giáo dục nghề nghiệp, trung tâm giáo dục thường xuyên - giáo dục nghề nghiệp trên địa bàn có xét tuyển học sinh tốt nghiệp THCS. Việc xét tuyển căn cứ vào điểm tốt nghiệp THCS, Điểm tổng kết các môn 4 năm THCS, điểm tổng kết các môn học năm cuối cấp THCS. Hơn 20.000 học sinh rớt lớp 10 công lập có thể học ở đâu? Sau đây là chi tiết chỉ tiêu tuyển sinh lớp 10 tất cả các trường ngoài công lập TP.HCM năm 2022:",Lê Huyền, thi vào lớp 10 ,18/05/2022   06:47 (GMT+07:00),Hơn 20.000 học sinh TP.HCM rớt lớp 10 công lập học ở đâu?,https://vietnamnet.vn/hon-20-000-hoc-sinh-tp-hcm-rot-lop-10-cong-lap-hoc-o-dau-2020197.html
