doandan,like,linkanh,loai,noidung,tacgia,tags,thoigian,tieude,url
"Tại buổi gặp mặt các chuyên gia Mạng lưới đổi mới sáng tạo Việt Nam, Bộ trưởng Nguyễn Chí Dũng khuyến khích đội ngũ doanh nhân người Việt tại Mỹ: “Đem ước mơ về lại Việt Nam để phát triển cùng đất nước.”",,"https://static-images.vnncdn.net/files/publish/2022/5/20/dmst-bo-truong-nguyen-chi-dung-2-1023.jpg,https://static-images.vnncdn.net/files/publish/2022/5/20/dmst-vu-duy-thuc-1024.jpg,https://static-images.vnncdn.net/files/publish/2022/5/20/dmst-bo-truong-nguyen-chi-dung-1025.jpg",Công nghệ,"Trong khuôn khổ chuyến thăm chính thức của Thủ tướng Phạm Minh Chính cùng phái đoàn Việt Nam tới thăm và làm việc tại Hoa Kỳ, Mạng lưới đổi mới sáng tạo (ĐMST) Việt Nam tại Hoa Kỳ đã tổ chức cuộc họp mặt và ra mắt Ban thường trực tại Thành phố San Francisco. Tham dự chương trình có Bộ trưởng Bộ Kế hoạch và Đầu tư (KH&ĐT) Nguyễn Chí Dũng, Bộ trưởng Bộ ngoại giao Bùi Thanh Sơn cùng đại diện các Mạng lưới ĐMST ở các nước Nhật Bản, Hàn Quốc, châu Âu và Úc. Mạng lưới đổi mới sáng tạo Việt Nam được công bố thành lập năm 2018 tại Hà Nội nhằm thúc đẩy xây dựng một hệ sinh thái đổi mới sáng tạo để hỗ trợ tốt nhất cho các công ty khởi nghiệp cũng như các ý tưởng đổi mới sáng tạo đột phá, giúp doanh nghiệp tăng trưởng cao nhằm phát triển kinh tế quốc gia.  Thành viên của Mạng lưới ĐMST tại Hoa Kỳ gồm hơn 50 tiến sĩ, thạc sĩ đang làm việc tại các trường đại học và tập đoàn công nghệ lớn như Facebook, Google, NASA, Cisco cùng nhiều tên tuổi khác.  Trong những năm qua, ban thường trực Mạng lưới đổi mới sáng tạo Việt Nam tại Hoa Kỳ đã đóng vai trò là người giới thiệu cho các nhà khoa học, các startup, các nhà sáng chế gốc Việt biết đến Mạng lưới  Việt Nam và tham gia đông đảo vào mạng lưới này. Trung tâm đổi mới sáng tạo quốc gia (NIC, Bộ KH&ĐT) chính là đầu mối trực tiếp để hỗ trợ, kết nối những ý tưởng, dự án liên quan đến Việt Nam khi các đối tác về Việt Nam. Trong gần 3 năm hoạt động, nhận được sự bảo trợ của Bộ trưởng Nguyễn Chí Dũng và Trung tâm đổi mới sáng tạo Quốc gia, nhiều hoạt động của cộng đồng trí thức, doanh nhân công nghệ ở Thung lũng Silicon đã được thúc đẩy nhanh chóng, thuận lợi. Trong đó, có thể kể đến dự án Giải Mã Gen Genetica với công nghệ bản quyền dành cho người châu Á, dự án GmarTech đào tạo nhân lực Marketing Digital, Dự án STEAM for Vietnam, Dự án đào tạo công nghệ Blockchain và nhiều dự án công nghệ cao khác. Chia sẻ tại buổi gặp mặt, Bộ trưởng Bộ Kế hoạch và Đầu tư Nguyễn Chí Dũng cho biết: “Đã có nhiều bạn phải thường xuyên di chuyển giữa Mỹ và Việt Nam để thực hiện những dự án được ấp ủ ở Thung lũng Silicon. Thời gian qua, do dịch Covid-19 nên nhiều dự án có thể đã bị gián đoạn. Tôi hy vọng rằng, trong thời gian tới, sẽ có thêm nhiều bạn đang ngồi đây cũng như ở Hoa Kỳ sẽ đem những ước mơ đó về lại Việt Nam để phát triển cùng đất nước.” Theo bà Nguyễn Ngọc Dung - người điều phối chính trong quá trình vận động, kết nối của NIC với các chuyên gia và trí thức người Việt tại San Francisco tham gia vào Mạng lưới: “NIC sẽ tiếp tục bảo trợ, phối hợp và kết nối các hoạt động nhằm quy tụ và phát huy nguồn lực trí thức to lớn của người Việt ở khắp nơi trên thế giới, góp phần thúc đẩy đổi mới sáng tạo của Việt Nam”. Trong thời gian tới, Mạng lưới ĐMST Việt Nam tại Hoa Kỳ sẽ phối hợp cùng Trung tâm ĐMST Quốc gia (NIC) để thúc đẩy 5 lĩnh vực gồm giáo dục STEM, hỗ trợ doanh nghiệp, công nghệ bán dẫn, công nghệ sinh học, và công nghệ chuỗi khối (Blockchain).",Trọng Đạt," Đổi mới sáng tạo , Trí thức , Chuyên gia , STEM , Blockchain , Công nghệ ",20/05/2022   19:07 (GMT+07:00),Bộ trưởng Nguyễn Chí Dũng họp mặt Mạng lưới đổi mới sáng tạo Việt Nam tại Mỹ,https://vietnamnet.vn/bo-truong-nguyen-chi-dung-hop-mat-mang-luoi-doi-moi-sang-tao-viet-nam-tai-my-2021516.html
Tổng công ty Bưu điện Việt Nam (Vietnam Post) vừa ra mắt Trung tâm Kinh doanh Chuyển phát Thương mại điện tử Hà Nội. Đây được coi là một trong những “cú hích” quan trọng trong lĩnh vực chuyển phát thương mại điện tử trong nước.,,"https://static-images.vnncdn.net/files/publish/2022/5/21/vnpost-1-366.jpg,https://static-images.vnncdn.net/files/publish/2022/5/21/vnpost-2-367.jpg",Công nghệ,"Với nhiệm vụ chính là điều hành kinh doanh, thiết kế các dịch vụ chuyển phát thương mại điện tử (TMĐT) phù hợp với nhu cầu của thị trường, Trung tâm Kinh doanh chuyển phát Thương mại điện tử Hà Nội sẽ là một mắt xích quan trọng kết nối người mua và người bán hàng online trên toàn quốc. Trung tâm sẽ vận hành và quản lý 6 hub lớn chuyên biệt về hàng TMĐT trên toàn thành phố Hà Nội. Năm 2022, Trung tâm đặt mục tiêu sản lượng sẽ đạt gần 48,2 triệu tấn hàng TMĐT.  Việc xây dựng một Trung tâm phục vụ chuyên biệt hàng hóa thương mại điện tử với sự đầu tư cả về hệ thống cơ sở hạ tầng cả về ứng dụng công nghệ không chỉ đáp ứng nhu cầu ngày càng sôi động của thị trường mà còn làm phong phú thêm trải nghiệm của khách hàng. Bên cạnh đó chất lượng dịch vụ chuyển phát hàng thương mại cũng được nâng cao rõ rệt, tốc độ giao hàng nhanh hơn, giá thành hợp lý hơn, qua đó giúp các doanh nghiệp thương mại điện tử kinh doanh hiệu quả hơn, đồng thời cũng tạo động lực cho thương mại điện tử tại Việt Nam phát triển mạnh mẽ trong thời gian tới. Ngay khi đi vào hoạt động, Trung tâm sẽ mở rộng thêm các kênh bán tiềm năng thông qua mạng xã hội, các sàn TMĐT, hệ thống cộng tác viên cũng như đại lý TMĐT. Đồng thời đồng bộ, chuyên nghiệp hóa hoạt động cung cấp dịch vụ, chăm sóc khách hàng, đẩy nhanh tốc độ đối soát thanh toán; mở rộng thêm các dịch vụ cho cả khách hàng lẫn nội bộ.  Ông Nguyễn Kiên Cường, Phó Tổng Giám đốc Tổng công ty Bưu điện Việt Nam cho biết, Chuyển phát TMĐT được xác định là một trong 3 trục kinh doanh chính của Vietnam Post. Trung tâm Kinh doanh Chuyển phát TMĐT Hà Nội sẽ là “cú hích” lớn trong lĩnh vực chuyển phát TMĐT.  “Sự thay đổi này sẽ mang đến khí thế mới, nguồn lực mới tạo sự bứt phá trong lĩnh vực kinh doanh TMĐT của Bưu điện Việt Nam. Mỗi bước đi, mỗi hoạt động của Trung tâm sẽ gắn với sự kì vọng, niềm tin và hơn hết là trách nhiệm đối với lĩnh vực kinh doanh trọng yếu của Tổng công ty. Trung tâm cần tổ chức hoạt động hiệu quả, mang lại những giá trị khác biệt, tạo được sự tin yêu của đông đảo khách hàng”, ông Nguyễn Kiên Cường khẳng định.",Xuân Thạch," Vietnam Post , Bưu điện , thương mại điện tử ",21/05/2022   12:15 (GMT+07:00),Vietnam Post ra mắt trung tâm chuyên biệt về chuyển phát thương mại điện tử,https://vietnamnet.vn/vietnam-post-ra-mat-trung-tam-chuyen-biet-ve-chuyen-phat-thuong-mai-dien-tu-2021778.html
"Với sự hỗ trợ của các chuyên gia Tổ Công tác 1034, hơn 100 Đoàn viên ở hai tỉnh Sóc Trăng, Vĩnh Long đã nắm bắt được kỹ năng cơ bản về kinh doanh trên sàn thương mại điện tử.",,https://static-images.vnncdn.net/files/publish/2022/5/18/ngnupguw-1266.jpg,Công nghệ số & Truyền thông,"Chiều 18/5, Tổ Công tác 1034 – Bộ Thông tin và Truyền thông triển khai chương trình tập huấn trực tuyến về chuyển đổi số, kỹ năng kinh doanh thương mại điện tử cho hơn 100 Đoàn viên ở hai tỉnh Sóc Trăng, Vĩnh Long. Ông Dương Tôn Bảo, Phó Vụ trưởng Vụ Bưu chính, Tổ phó Tổ Công tác 1034 cho biết: Năm 2021, Bộ Thông tin và Truyền thông đã ban hành Kế hoạch số 1034 hỗ trợ đưa hộ sản xuất nông nghiệp lên sàn thương mại điện tử, thúc đẩy phát triển kinh tế số nông nghiệp, nông thôn. Nội dung chính của Kế hoạch gồm: Hỗ trợ đưa hộ sản xuất nông nghiệp lên sàn thương mại điện tử; Hỗ trợ đẩy mạnh tiêu thụ sản phẩm nông nghiệp; Cung cấp thông tin, nguyên liệu đầu vào phục vụ sản xuất kinh doanh.  Thời gian qua, các địa phương đều rất tích cực triển khai Kế hoạch số 1034 và bước đầu có kết quả tốt. Điển hình như 1 hợp tác xã tại xã Yên Hòa (huyện Yên Mô, tỉnh Ninh Bình): Sản phẩm được đưa lên các sàn thương mại điện tử để bán qua mạng, thành viên hợp tác xã tăng thu nhập từ 1,5 triệu đồng/tháng lên 4 – 5 triệu đồng/tháng. “Chương trình tập huấn lần này cho Đoàn viên của hai tỉnh Sóc Trăng, Vĩnh Long cũng là một trong những nội dung triển khai Kế hoạch số 1034. Tài liệu tập huấn được đăng tải trên Cổng thông tin điện tử 1034 ( ) và sẽ được chuyển giao cho các huyện Đoàn, xã Đoàn để tiếp tục đào tạo cho các Đoàn viên, thanh niên ở địa phương. Sau buổi tập huấn, nếu các Đoàn viên có thể áp dụng kiến thức được học vào thực tế thì sẽ góp phần thúc đẩy phát triển kinh tế tại địa phương, đặc biệt là kinh tế số”, ông Dương Tôn Bảo nói. Trong chiều 18/5, các chuyên gia của Tổ 1034 đã giúp các học viên nắm được mô hình chuyển đổi số chuỗi sản xuất; cách thức xây dựng thương hiệu cho sản phẩm nông sản, sản phẩm OCOP; các kỹ năng cơ bản để kinh doanh trên hai sàn thương mại điện tử Postmart (Postmart.vn của Tổng Công ty Bưu điện Việt Nam) và Vỏ Sò (Voso.vn của Tổng Công ty Cổ phần Bưu chính Viettel)… Qua phần kiểm tra trắc nghiệm cuối buổi, 6 học viên làm bài nhanh và đúng nhất được trao Giấy chứng nhận hoàn thành xuất sắc khóa tập huấn lần này. Tập huấn kỹ năng kinh doanh số là một trong những nội dung chính của Chương trình tập huấn “Chuyển giao khoa học, công nghệ cho cán bộ, Đoàn viên, thanh niên theo hình thức trực tuyến năm 2022” do Trung tâm Phát triển khoa học công nghệ và tài năng trẻ - Trung ương Đoàn Thanh niên cộng sản Hồ Chí Minh chủ trì, phối hợp tổ chức tại nhiều tỉnh, thành trên cả nước. Dự kiến chương trình tập huấn tiếp theo sẽ được triển khai trong 2 ngày 8 - 09/6 cho các Đoàn viên ở 3 tỉnh: Yên Bái, Sơn La, Lào Cai.",Bình Minh, 1034 ,19/05/2022   06:46 (GMT+07:00),"Đoàn viên ở Sóc Trăng, Vĩnh Long học cách “lên sàn”",https://vietnamnet.vn/doan-vien-o-soc-trang-vinh-long-hoc-cach-len-san-2020894.html
CMC Telecom đã hợp tác với Uniphore - công ty hàng đầu trong lĩnh vực cung cấp giải pháp tự động hóa đàm thoại (Conversational Automation).,,https://static-images.vnncdn.net/files/publish/2022/5/20/uniphore-1-939.jpg,Công nghệ,"Quan hệ đối tác chiến lược này sẽ tạo điều kiện giúp CMC Telecom cung cấp cho khách hàng các giải pháp quản lý trải nghiệm khách hàng và truyền thông toàn diện với các giải pháp tùy chỉnh theo quy trình đầu cuối hoàn thiện trên nền tảng tự động hóa đàm thoại (Conversational Automation) của Uniphore.   CMC Telecom và Uniphore sẽ ứng dụng các tính năng nâng cao trải nghiệm khách hàng vào các lĩnh vực khác nhau, bao gồm: dịch vụ tài chính và bảo hiểm, ngân hàng, thị trường thương mại điện tử và viễn thông. Ông Lê Anh Vũ - Giám đốc Sáng tạo (CIO - Chief Innovation Officer), kiêm Giám đốc Khối Công nghệ Điện toán đám mây, CMC Telecom cho biết: “Việc hợp tác với Uniphore sẽ đem đến những giá trị thiết thực cho khách hàng của CMC Telecom, đồng thời giúp chúng tôi hoàn thiện hệ sinh thái sản phẩm dịch vụ trên cơ sở hạ tầng điện toán đám mây nói chung, cũng như đẩy mạnh các dịch vụ Thoại và Truyền thông hợp nhất - một trong những chiến lược quan trọng nhằm đưa CMC trở thành tập đoàn tỷ đô vào năm 2025”.  Theo ông Vũ, quan hệ đối tác chiến lược này mang đến trải nghiệm khách hàng vượt trội, cũng như đem lại những lợi ích ngắn hạn và dài hạn. Như đưa ra những gợi ý và hướng dẫn cho nhân viên CSKH trong quá trình đàm thoại với khách nhằm đảm bảo tính nhất quán trong mọi cuộc gọi và tuân thủ các yêu cầu kinh doanh, từ đó loại bỏ mâu thuẫn, tranh cãi với khách hàng cũng như cải thiện trải nghiệm khách hàng. Bên cạnh đó, sự hợp tác sẽ mang đến những kết quả tốt hơn trong mọi tương tác với khách hàng bao gồm các cuộc gọi thoại, email và tin nhắn văn bản. định hình việc lập kế hoạch chiến lược và cải tiến hoạt động; Tích hợp công nghệ low code/no code cho phép các nhà phát triển phần mềm dễ dàng kéo và thả các thành phần, từ đó kết nối và tạo ra các ứng dụng, cho phép người dùng không chuyên về kỹ thuật đạt được những gì mà trước đây chỉ có thể làm được khi có kiến thức về lập trình. CMC Telecom là đơn vị mới nhất tham gia vào Chương trình Đối tác Unite của Uniphore được ra mắt vào cuối năm 2021. Chương trình này cung cấp cho đối tác các nguồn lực cần thiết để áp dụng công nghệ tiên tiến, phát triển danh mục sản phẩm và dịch vụ của họ nhằm nâng cao doanh thu.",Thúy Ngà, CMC Telecom ,21/05/2022   08:00 (GMT+07:00),CMC Telecom hợp tác Uniphore tối ưu hóa trải nghiệm khách hàng,https://vietnamnet.vn/cmc-telecom-hop-tac-uniphore-toi-uu-hoa-trai-nghiem-khach-hang-2021557.html
"Chất lượng camera chỉ đóng một phần vai trò trong việc chụp những bức ảnh đẹp. Với những lưu ý dưới đây, bạn vẫn có thể tạo ra những bức ảnh tuyệt vời ngay cả với smartphone cũ.",,https://static-images.vnncdn.net/files/publish/2022/5/19/bi-kip-chup-anh-dep-voi-dien-thoai-cu-122.jpg,Công nghệ,"Phần cứng không phải là yếu tố quyết định tất cả trong việc tạo ra những bức ảnh đẹp. Với những lưu ý dưới đây, bạn có thể chụp những bức ảnh tuyệt vời ngay cả với những smartphone cũ. Dù chụp ảnh bằng hệ thống camera chuyên nghiệp, nếu đặt sai bố cục khung hình, bạn sẽ không có bức ảnh đẹp. Một trong những lưu ý phổ biến nhất trong bố cục nhiếp ảnh là quy tắc 1/3. Khung hình được chia thành 9 phần bằng nhau bởi hai đường dọc và hai đường ngang. Bạn cần căn chỉnh sao cho vật thể dọc theo các đường này hoặc tại điểm mà hai đường giao nhau. Quy tắc này làm nổi bật và cân bằng đối tượng trong không gian và thời gian. Trên iPhone bạn có thể cài đặt bật sẵn phần khung lưới trong camera. Nếu điện thoại của bạn có cụm camera phía sau với khả năng zoom hoặc góc rộng, hãy thử các tùy chọn khác nhau này. Bạn có thể phóng to giúp loại bỏ các yếu tố gây mất tập trung phía sau, hoặc mở rộng ống kính để thu được nhiều cảnh đẹp phía trước. Nếu bạn không có chế độ xem góc rộng, hãy thử sử dụng chế độ toàn cảnh. Các công ty như Moment và Olloclip sản xuất ống kính rời để gắn vào điện thoại, cung cấp khả năng chụp góc rộng, chụp xa và thậm chí cả macro. Chắc chắn, sẽ bất tiện hơn khi bạn phải mang thêm một món đồ nhỏ trong túi, nhưng thêm một ống rời gắn vào điện thoại vào là một cách tuyệt vời để có được những bức ảnh siêu rộng thay vì phải chi một số tiền lớn để nâng cấp điện thoại. Định dạng hình ảnh ProRaw của Apple, được giới thiệu trên iPhone 12 Pro Max, có thể cho ra một bức ảnh chi tiết hơn và được tối ưu qua hàng loạt chế độ như Smart HDR, Deep Fusion. Ngoài ra cung cấp cho bạn tệp thô DNG để dễ dàng chỉnh sửa ảnh trong các ứng dụng như Adobe Lightroom. Đây không phải là một chức năng được tìm thấy trên các iPhone đời cũ hơn, nhưng bạn có thể sử dụng ứng dụng máy ảnh của ứng dụng thứ ba cung cấp chế độ chụp ảnh raw. Chẳng hạn như camera của Lightroom cho phép chụp ở dạng raw và tự động đồng bộ hình ảnh vào thư viện.  chỉ là một phần của quá trình tạo ra một bức ảnh đẹp. “Con mắt tinh tường” trong khâu chỉnh sửa có thể tạo nên sự khác biệt lớn. Hiện có rất nhiều các ứng dụng chỉnh sửa để khiến các bức ảnh của bạn trông sắc nét hoặc nghệ thuật hơn như: Lightroom, Snapseed, Remini… Các trình chỉnh sửa hình ảnh thô này cho phép bạn điều chỉnh màu sắc, độ phơi sáng, độ tương phản và nhiều hơn thế nữa. Những hình ảnh mang tính biểu tượng, có sức ảnh hưởng lớn không chỉ đơn giản là những hình được chụp bằng máy ảnh tốt nhất mà còn là những hình ảnh kể một câu chuyện cụ thể hoặc ghi lại một khoảnh khắc kịp thời. Chẳng hạn khi đi du lịch, hãy ghi lại tất cả những thứ làm cho chuyến đi trở nên đáng nhớ như đồ ăn ngon, những con phố cổ kính, người nhạc công chơi đàn ở quảng trường hay màu sắc rực rỡ của những gian hàng hoa trái ở chợ quê. Tất cả những yếu tố này sẽ kể một câu chuyện hình ảnh tuyệt vời khi bạn nhìn lại chúng. Trong khi các smartphone hàng đầu hiện nay như iPhone 13 Pro, Galaxy S22 Ultra hoặc Pixel 6 Pro có thể chụp ảnh ban đêm tuyệt vời, thì các mẫu cũ hơn có thể sẽ không có chế độ chụp ban đêm. Do đó, bóng tối sẽ là trở ngại lớn nhất để các dòng điện thoại cũ chụp được những hình ảnh đẹp. Vì thế nếu có điện thoại cũ, hãy cố gắng chụp ảnh trong điều kiện đủ sáng, hoặc tận dụng ánh sáng ban ngày để tìm kiếm độ tương phản do bóng đổ gây ra, từ đó tạo nên những bức hình ấn tượng.","Chú ý bố cục,Sử dụng ống kính rời,Để file ảnh Raw,Tận dụng các app chỉnh sửa,Kể chuyện,Tận dụng ánh sáng,Hương Dung"," smartphone , chụp ảnh ",19/05/2022   08:24 (GMT+07:00),Bí kíp chụp ảnh bằng smartphone cũ vẫn đẹp lung linh,https://vietnamnet.vn/bi-kip-chup-anh-bang-smartphone-cu-van-dep-lung-linh-2020921.html
