doandan,like,linkanh,loai,noidung,tacgia,tags,thoigian,tieude,url
"Theo Thứ trưởng Bộ KH&CN Lê Xuân Định, cần đẩy mạnh việc đào tạo nguồn nhân lực về khoa học, công nghệ, đổi mới sáng tạo từ chính các em học sinh, thế hệ măng non của đất nước.",,"https://static-images.vnncdn.net/files/publish/2022/5/20/ngay-hoi-stem-3-484.jpg,https://static-images.vnncdn.net/files/publish/2022/5/20/ngay-hoi-stem-1-485.jpg,https://static-images.vnncdn.net/files/publish/2022/5/20/ngay-hoi-stem-thu-truong-le-xuan-dinh-486.jpg",Công nghệ,"Sáng 20/5, Ngày hội STEM năm 2022 đã được tổ chức tại trụ sở Bộ Khoa học & Công nghệ (KH&CN). Ngày hội STEM là một hoạt động thường niên nhằm phổ biến và nâng cao nhận thức xã hội về giáo dục STEM - một mô hình giáo dục hiện đại đã được triển khai ở nhiều nước trên thế giới.  STEM là viết tắt của các từ Science (Khoa học), Technology (Công nghệ), Engineering (Kỹ thuật) và Math (Toán học).  Giáo dục STEM là một quan điểm dạy học theo tiếp cận liên ngành, từ hai trong số bốn lĩnh vực nêu trên trở lên. Trong đó, nội dung học tập được gắn với thực tiễn, còn phương pháp học tập được gắn với thực hành để học sinh làm quen với việc phát triển ý tưởng sáng tạo và nắm bắt định hướng nghề nghiệp ngay từ khi ngồi trên ghế nhà trường. Ở Việt Nam, giáo dục STEM đã được manh nha từ năm học 2006-2007, khi Bộ Giáo dục và Đào tạo thử nghiệm việc thành lập các nhóm nghiên cứu khoa học tại một số trường THPT để chuẩn bị tham gia cuộc thi khoa học - kỹ thuật ISEF cấp tỉnh/thành phố.  Sau đó, vào đầu những năm 2010, bắt đầu xuất hiện các doanh nghiệp nhập chương trình giáo dục STEM từ nước ngoài về và đưa vào dạy ngoại khóa tại một số trường phổ thông ở những thành phố lớn. Trong những năm qua, Bộ Giáo dục và Đào tạo đã có nhiều chủ trương ủng hộ và khuyến khích giáo dục STEM như đưa giáo dục STEM vào nhiệm vụ không bắt buộc của các trường THCS và THPT (năm 2014), chỉ đạo việc thành lập CLB STEM ở tất cả các trường phổ thông (năm 2015),... Gần đây nhất, Chương trình Giáo dục phổ thông nới được công bố vào cuối năm 2018 đã thể hiện sự đề cao giáo dục STEM ở việc yêu cầu dạy học tích hợp, tạo điều kiện tổ chức các chủ đề STEM, góp phần phát triển năng lực vận dụng kiến thức liên môn giải quyết các vấn đề thực tiễn cho học sinh. Ngày hội STEM là sự kiện được tổ chức lần đầu vào năm 2015 theo sáng kiến của Tạp chí Tia Sáng và Liên minh STEM, dưới sự bảo trợ của Bộ Khoa học và Công nghệ. Kể từ đó đến nay, sự kiện này được tổ chức thường niên vào dịp Ngày hội Khoa học và Công nghệ Việt Nam (18/5).  Những năm qua, Ngày hội STEM đã luôn thu hút đông đảo học sinh, giáo viên, phụ huynh, nhà nghiên cứu, chuyên gia, nhà quản lý và người yêu thích khoa học công nghệ. Nếu như ở những năm trước, Ngày hội STEM chỉ tập trung vào một sự kiện diễn ra tại Hà Nội thì lần này, Ngày hội STEM 2022 bao gồm một chuỗi hoạt động ở hơn 10 địa phương trên cả nước. Điều này cho thấy, giáo dục STEM đã bắt đầu lan tỏa và hình thành được nền tảng phát triển vững chắc từ dưới lên.  Sự kiện được tổ chức trực tiếp kết hợp trực tuyến với sự tham gia thuyết trình của khoảng 30 học sinh, sinh viên và thầy cô đến từ 13 tỉnh/thành phố: Hà Nội, TPHCM, Nam Định, Lạng Sơn, Yên Bái, Phú Thọ, Thái Nguyên, Lào Cai, Cao Bằng, Lai Châu, Hà Tĩnh, Phú Yên, Bến Tre. Tại Ngày hội STEM 2022, lần đầu tiên có một diễn đàn riêng để các em học sinh từ thành thị đến nông thôn và miền núi, từ trường chuyên danh tiếng đến trường làng giới thiệu các hoạt động học tập, sinh hoạt câu lạc bộ theo định hướng STEM. Chia sẻ tại Ngày hội STEM 2022, Thứ trưởng Bộ KH&CN Lê Xuân Định khẳng định, chuyển đổi số là một xu thế tất yếu, đã được Đảng, Chính phủ, Thủ tướng Chính phủ xác định là giải pháp để nâng cao năng lực, lợi thế cạnh tranh, tồn tại và phát triển.  Phương pháp tiếp cận liên môn, liên ngành thông qua giáo dục STEM là một cách tiếp cận phù hợp để nâng cao các kiến thức và   cho người trẻ. “Để đưa Việt Nam thoát khỏi bẫy thu nhập trung bình, trở thành nước phát triển, có thu nhập cao vào năm 2045, chúng ta phải đẩy mạnh các hoạt động đào tạo nguồn nhân lực từ chính các em học sinh, qua đó đẩy mạnh việc ứng dụng khoa học công nghệ và đổi mới sáng tạo để phát triển kinh tế xã hội của đất nước”, Thứ trưởng Lê Xuân Định nói.","Giáo dục STEM giúp phát triển năng lực vận dụng kiến thức liên môn ,Giáo dục STEM sẽ nâng cao kiến thức, kỹ năng chuyển đổi số cho giới trẻ,Trọng Đạt"," STEM , Giáo dục STEM , Kỹ năng số , Khoa học Công nghệ , Đổi mới sáng tạo , chuyển đổi số ",20/05/2022   13:31 (GMT+07:00),"Giáo dục STEM là cách tiếp cận phù hợp để nâng cao kiến thức, kỹ năng số",https://vietnamnet.vn/giao-duc-stem-la-cach-tiep-can-phu-hop-de-nang-cao-kien-thuc-ky-nang-so-2021394.html
"Ô tô đâm trực diện vào xe tải cẩu trên đại lộ Mai Chí Thọ (TP Thủ Đức), cả hai phương tiện cháy trơ khung, hai người tử vong.",,"https://static-images.vnncdn.net/files/publish/2022/5/21/z3430548532728-9d2b24e1ccc0c5464d4b08496c29a61b-151.jpg,https://static-images.vnncdn.net/files/publish/2022/5/21/z3430548527114-ace270a8c7304e535fe062815c005b52-152.jpg",Thời sự,"Công an TP Thủ Đức (TP.HCM) đang điều tra vụ tai nạn nghiêm trọng trên đại lộ Mai Chí Thọ đoạn qua khu vực cầu Cá Trê Lớn, phường An Lợi Đông. Khoảng 23h30 khuya hôm qua (20/5), người dân chứng kiến một ôtô loại 4 chỗ (chưa rõ BKS) chạy trên đường Trần Quý Kiên, hướng đảo Kim Cương ra Mai Chí Thọ. Khi phương tiện chạy đến giao lộ Mai Chí Thọ, ô tô này rẽ trái chạy ngược chiều trên đại lộ này hướng về hầm Thủ Thiêm. Ô tô chạy đến khu vực cầu Cá Trê Lớn đã tông trực diện xe tải cẩu chạy đúng chiều theo hướng ngược lại. Cú tông cực mạnh khiến hai phương tiện cháy ngùn ngụt. Tài xế xe tải cẩu mở cửa thoát kịp ra ngoài. Riêng hai người khác ngồi trên ôtô 4 chỗ tử vong tại chỗ (chưa rõ danh tính). Cảnh sát Phòng cháy chữa cháy và cứu nạn, cứu hộ Công an TP Thủ Đức đã khống chế vụ hỏa hoạn.",Thảo Nguyên," tai nạn giao thông , tai nạn chết người , chạy ngược chiều , đại lộ Mai Chí Thọ , TPHCM ",21/05/2022   10:13 (GMT+07:00),"Cú đâm trực diện khiến ô tô và xe tải cẩu cháy rụi, 2 người tử vong",https://vietnamnet.vn/cu-dam-truc-dien-khien-o-to-va-xe-tai-cau-chay-rui-2-nguoi-tu-vong-2021734.html
"Cơ quan Cảnh sát điều tra (C01-Bộ Công an) cho biết đã ban hành kết luận điều tra bổ sung vụ án hình sự Nguyễn Thế Kiên (SN 1983, quê Bắc Giang) cùng đồng phạm về hành vi chiếm đoạt tài sản.",,https://static-images.vnncdn.net/files/publish/2022/5/20/siddysps-981.jpeg,Thời sự,"Theo C01-Bộ Công an, vụ án trên xảy ra tại TP.HCM và một số tỉnh, thành phố khác. Việc điều tra bổ sung được thực hiện theo quyết định trả hồ sơ vụ án để điều tra bổ sung của Viện Kiểm sát nhân dân tối cao.   Sau quá trình điều tra bổ sung, ngày 10/5, Cơ quan Cảnh sát điều tra Bộ Công an đã ban hành bản kết luận điều tra bổ sung và chuyển toàn bộ hồ sơ vụ án đến Viện kiểm sát nhân dân tối cao đề nghị truy tố 6 bị can: Lê Đình Nhân, Nguyễn Thế Kiên, Nguyễn Hữu Trí, Hà Thanh Hòa, Nguyễn Thị An và Vũ Vi Minh Trí về tội Sử dụng mạng máy tính, mạng viễn thông, phương tiện điện tử thực hiện hành vi chiếm đoạt tài sản quy định tại khoản 4 Điều 290 Bộ luật Hình sự. Trước đó, ngày 30/3, TAND TP.HCM mở phiên xét xử sơ thẩm với các bị cáo nêu trên về cùng tội danh. Cơ quan tố tụng đến nay xác định các bị cáo chiếm đoạt số tiền 102 tỷ đồng của hơn 160 bị hại.  Ngày 31/3, TAND TP.HCM trả hồ sơ để điều tra bổ sung vụ án do vụ án có thêm gần 50 bị hại nộp đơn đến HĐXX. Theo hồ sơ, Kiên cùng đồng phạm có nhiều năm kinh doanh trong lĩnh vực đa cấp. Để chiếm đoạt tiền của nhà đầu tư, các đối tượng đã tổ chức phối hợp thành lập, điều hành hoạt động Công ty TNHH đầu tư khoáng sản Hoàng Long.  Tại đây, Kiên điều hành chỉ đạo chung, thuyết trình tại các hội thảo kêu gọi đầu tư. Các thành viên còn lại đảm nhận các vị trí dựng phần mềm, phát triển thị trường, kế toán... Tháng 6/2016, công ty được cấp giấy phép đăng ký doanh nghiệp có trụ sở đặt tại đường Nguyễn Huệ, quận 1, TP.HCM.  Sau khi được cấp đăng ký kinh doanh, Kiên cùng đồng phạm không thực hiện hoạt động kinh doanh theo ngành nghề đăng ký mà dùng thủ đoạn huy động vốn theo mô hình đa cấp nhị phân, lấy tiền của bị hại gửi sau trả cho người gửi tiền trước. Các thành viên công ty hưởng lợi từ chính tiền của bị hại. Bằng thủ đoạn nêu trên, từ ngày 1/6 đến 11/2016, Kiên cùng đồng phạm đã lấy được của 161 người bị hại tổng số tiền 102 tỷ đồng. Sau khi lấy được số tiền trên, Kiên và đồng phạm đã trả lại cho 161 bị hại 44 tỷ đồng.",," Đa cấp , Bộ Công An ",20/05/2022   18:12 (GMT+07:00),Bộ Công an đề nghị truy tố 'trùm đa cấp' Nguyễn Thế Kiên,https://vietnamnet.vn/bo-cong-an-de-nghi-truy-to-trum-da-cap-nguyen-the-kien-2021598.html
"3 đối tượng sử dụng súng gây rối trên phố Hàng Bè (quận Hoàn Kiếm, Hà Nội) đã bị lực lượng công an bắt giữ.",,https://static-images.vnncdn.net/files/publish/2022/5/20/gay-roi-954.jpeg,Thời sự,"Ngày 20/5, Công an quận Hoàn Kiếm đã tạm giữ hình sự đối tượng Đặng Ngọc Điệp (SN 1979, ở phường Đại Kim, quận Hoàng Mai); Nguyễn Xuân Chiến (SN 1976, ở ngõ Phất Lộc, phường Hàng Buồm, quận Hoàn Kiếm) và Nguyễn Đức Nam (sinh năm 1990, ở ngõ Phất Lộc, phường Hàng Buồm, quận Hoàn Kiếm) để làm rõ hành vi gây rối trật tự công cộng liên quan đến vụ dùng súng giải quyết mâu thuẫn trên phố Hàng Bè. Như đã đưa tin, khoảng 5h sáng cùng ngày (20/5), Công an quận Hoàn Kiếm nhận được tin báo của người dân về việc có vụ đánh nhau, có thanh niên cầm 2 tay 2 súng dọa bắt người trên phố Hàng Bè nên đã nhanh chóng triển khai các tổ công tác kịp thời có mặt tại hiện trường. Vào thời điểm trên, trước cửa số 11 Hàng Bè , phường Hàng Bạc, quận Hoàn Kiếm xuất 1 hiện 1 thanh niên 2 tay cầm 2 vật nghi như súng đứng chĩa vào một thanh niên đối diện. Thanh niên này bóp cò vật nghi là súng không nổ, cả 2 sau đó lao vào nhau đánh nhau, giằng co đến tận khu vực ngã ba Gia Ngư đầu chợ Hàng Bè. Công an quận Hoàn Kiếm nhanh chóng có mặt tại hiện trường thu giữ tại hiện trường 1 súng quân dụng K59, 1 súng bật lửa và nhanh chóng sơ cứu khi cả 2 đều bị thương sau cuộc ẩu đả. Cơ quan công an bước đầu làm rõ, do mâu thuẫn cá nhân, Đặng Ngọc Điệp đã cầm 2 tay 2 súng hẹn Nguyễn Xuân Chiến nói chuyện. Khi Nguyễn Xuân Chiến cùng Nguyễn Đức Nam vừa đi từ nhà ra khu vực phố Hàng Bè thì chạm trán nhau, Đặng Ngọc Điệp lập tức rút súng bắn nhưng đạn không nổ. Hiện vụ việc đang được điều tra làm rõ.",Quyết Nguyễn," Hà Nội , gây rối trật tự công cộng ",20/05/2022   17:10 (GMT+07:00),Bắt giữ 3 người liên quan vụ '2 tay 2 súng' gây rối ở Hà Nội,https://vietnamnet.vn/bat-giu-3-nguoi-lien-quan-vu-2-tay-2-sung-gay-roi-o-pho-hang-be-2021572.html
"Chiều 20/5, 5 học sinh tại xã Hòa Quang Nam, huyện Phú Hòa đi tắm tại bãi biển Trần Phú thì không may gặp luồng nước xoáy cuốn ra xa bờ. Hai em Dương Minh Hiền và Nguyễn Trực (cùng SN 2007) đã bị đuối nước.",,,Thời sự,"Nhận tin báo, lực lượng chức năng Phường 7 phối hợp với Đội cứu hộ bờ biển Trung tâm Cung ứng Dịch vụ Công ích TP Tuy Hòa đã triển khai lực lượng ra ứng cứu đưa 3 học sinh vào bờ. Các thành viên đội cứu hộ đã sơ cứu, hô hấp nhân tạo cho các nạn nhân. Em Trịnh Xuân Phương may mắn đã tỉnh trở lại; em Dương Minh Hiền và em Nguyễn Trực bị ngừng thở... Ông Hà Bích Sơn, Chủ tịch UBND Phường 7 xác nhận hai em Dương Minh Hiền và Nguyễn Trực đã tử vong trước khi được đưa đến bệnh viện. Hiện gia đình đã làm thủ tục đưa thi thể các nạn nhân về địa phương. Từ đầu năm 2022 đến nay, tỉnh Phú Yên đã có 10 vụ đuối nước, trong đo có 7 vụ do tắm biển làm 9 người tử vong.",Trâm Trân," tử vong , Phú Yên ",20/05/2022   21:44 (GMT+07:00),Phú Yên: 2 học sinh tử vong khi đi tắm biển,https://vietnamnet.vn/phu-yen-2-hoc-sinh-tu-vong-khi-di-tam-bien-2021643.html
"Nguyễn Đức Tuân xuất sắc đánh bại tay vợt của Thái Lan trong trận chung kết nội dung đơn nam, qua đó mang về tấm HCV quý giá cho bóng bàn Việt Nam ở SEA Games 31.",,"https://static-images.vnncdn.net/files/publish/2022/5/20/nguyen-duc-tuan-bong-ban-sea-games-31-1-1171.jpg,https://static-images.vnncdn.net/files/publish/2022/5/20/nguyen-duc-tuan-bong-ban-sea-games-31-1-1339.jpg",Thể thao,"Sau khi đánh bại tay vợt hạng 123 thế giới người Singapore - Chew Zhe Yu Clarence, Nguyễn Đức Tuân chạm trán tay vợt kỳ cựu Pharpoom Sanguansin của Thái Lan trong trận chung kết tranh HCV nội dung đơn nam  . Sự cổ vũ nhiệt tình của đông đảo khán giả tại Nhà thi đấu tỉnh Hải Dương tối 20/5 giúp đại diện của nước chủ nhà có sự khở đầu thuận lợi với chiến thắng 11-7 ở set mở màn. Thừa thắng xông lên, Đức Tuân tiếp tục khiến Pharpoom liên tục rơi vào thế phải bám đuổi để khép lại set 2 với tỷ số điểm 11-9. Một chút nóng vội của Đức Tuân khiến anh không duy trì được sự hung phấn trong set 3, trong khi tay vợt của Thái Lan thắp lên hi vọng bằng chiến thắng 11-8. Tuy nhiên, đó cũng là set đấu duy nhất mà Pharpoom được ăn mừng. Bởi Đức Tuân đã trở lại đầy mạnh mẽ với khả năng tấn công hay mà phòng ngự cũng giỏi để rồi buộc đối thủ phải gác vợt trong 2 set sau đó, với điểm số 11-7 và 13-11. Chung cuộc, Đức Tuân giành chiến thắng với tỷ số 4-1 (11-7, 11-9, 8-11, 11-7 và 13-11) để lên ngôi vô địch đầy cảm xúc ngay trên quê nhà. Chiến thắng của Nguyễn Đức Tuân giúp bóng bàn Việt Nam có được tấm HCV đơn nam lần đầu tiên sau 19 năm. Trước đó, năm 2003, Trần Tuấn Quỳnh là người mang về HCV bóng bàn đơn nam trong kỳ SEA Games diễn ra trên sân nhà.","SEA Games 31,Nghĩa Hưng"," Nguyễn Đức Tuân , SEA Games , bóng bàn ",20/05/2022   22:13 (GMT+07:00),Nguyễn Đức Tuân giúp bóng bàn Việt Nam giành HCV SEA Games sau 19 năm,https://vietnamnet.vn/nguyen-duc-tuan-giup-bong-ban-viet-nam-gianh-hcv-sea-games-sau-19-nam-2021651.html
Kết quả bóng đá SEA Games hôm nay 21/5 - Cập nhật nhanh kết quả trận chung kết và tranh HCĐ bóng đá nữ SEA Games 31 mới nhất tại đây.,,,Thể thao,"21/5 - 15h30: Myanmar - Philippines  (VTV6, On Football) 21/5 - 19h00: Việt Nam - Thái Lan (VTV6, On Football)","Kết quả chung kết và tranh HCĐ bóng đá nữ ,:,Thiên Bình", Kết quả bóng đá ,21/05/2022   15:16 (GMT+07:00),Kết quả bóng đá SEA Games 31 hôm nay 21/5: Xác định ngôi hậu,https://vietnamnet.vn/ket-qua-bong-da-sea-games-31-hom-nay-21-5-2021623.html
"Không chỉ bảo vệ thành công HCV hạng cân 64kg, đô cử Phạm Thị Hồng Thanh còn xuất sắc phá 3 kỷ lục ở nội dung cử giật 104kg, cử đẩy 126kg và tổng cử 230kg.",,,Thể thao,,"Danh sách VĐV giành HCV cho đoàn Việt Nam ngày 21/5:,Phạm Thị Hồng Thanh bảo vệ thành công HCV hạng cân 64kg,Aerobic giành HCV đầu tiên,Môn,Địa điểm,Ngày,Thời gian,Nội dung,Vòng,Vận động viên,Kết quả,Ghi chú,Cầu lông, , , , ,Bắn súng, , , , , , , , , , , , , , , , ,MUAY, , , , , , , , , ,Canoeing, , , , , , , , , , , , , , ,Judo, , , , , ,Nhà thi đấu huyện Hoài Đức,21/5,-45 nữ , -48 nam , -55 nam, , , , , , , , , ,Bóng đá,Cẩm Phả,21/5, , ,Trao thưởng, , ,Bóng rổ,Thanh Trì,Hà Nội,21/5, , , , ,Cầu mây,Hoàng Mai,21/5, , , , , , , , , , , , , , , , ,Bi A,Hà Đông,Hà Nội,21/5,Carom 3 Cushions, , ,Quần vợt,Từ Sơn,Bắc Ninh,21/5, , , , ,Thể thao điện tử, , , , , ,Cử tạ,Nam 73 kg, , , , , ,Nữ 64kg, , , , ,Nam 81kg, , , , ,Nữ 71kg, , , , ,Vovinam, , , , , , , , , , , , , , , , , , , ,Xe đạp, , , , , , , , ,Cờ vua,Cờ chớp,Đồng đội,Sáng 21/5 Bốc thăm, , , , , , , , , ,Môn,Địa điểm,Ngày,Thời gian,Nội dung,Vòng,Vận động viên,Kết quả,Ghi chú,LẶN, , , , , , , , , , , , , , , , , , , , , ,Aerobic, , , , ,Bóng ném, , , , , ", SEA Games ,21/05/2022   08:55 (GMT+07:00),"Trực tiếp SEA Games 31 ngày 21/5: Hồng Thanh giành HCV, phá liền 3 kỷ lục cử tạ",https://vietnamnet.vn/truc-tiep-sea-games-31-ngay-21-5-chung-ket-bong-da-nu-lan-ra-quan-2021122.html
"Truyền thông Hàn Quốc rộn ràng cùng U23 Việt Nam và HLV Park Hang Seo đánh bại Malaysia kịch tính, tiến gần HCV SEA Games 31 với cuộc đấu U23 Thái Lan ở chung kết.",,"https://static-images.vnncdn.net/files/publish/2022/5/20/u23-viet-nam-u23-malaysia-tien-linh-5-223.jpg,https://static-images.vnncdn.net/files/publish/2022/5/20/u23-viet-nam-cam-on-khan-gia-2-224.jpg,https://static-images.vnncdn.net/files/publish/2022/5/20/u23-viet-nam-u23-malaysia-5-225.jpg",Thể thao,“ ”. Còn tờ Chosun phản ánh: “ ”. Newsis cập nhật về đội bóng áo đỏ: “ ”. Tờ Osen thông tin:  ”.,Mai Nguyễn," U23 Việt Nam , U23 Thái Lan , SEA Games , báo Hàn Quốc ",20/05/2022   14:07 (GMT+07:00),"‘U23 Việt Nam đấu Thái Lan, HCV SEA Games vẫy gọi lần nữa’",https://vietnamnet.vn/u23-viet-nam-dau-thai-lan-hcv-sea-games-vay-goi-lan-nua-2021375.html
